web-scraper-order,web-scraper-start-url,name,description,image-src,link,link-href,rating,review-count
"1668875199-46699","https://www.udacity.com/courses/all?field=school-of-business","Cloud Computing for Business Leaders","Focus on the unique knowledge and skills that business leaders need to unlock the value of cloud technologies in their organizations.","https://www.udacity.com/www-proxy/contentful/assets/2y9b3o528xhq/6IIUwmXtznUr9zz2Iy9cBh/9dcdd2b93d2655f9373d400e2e8da3c7/catalog-card-7.jpg","nanodegreeCloud Computing for Business LeadersFocus on the unique knowledge and skills that business leaders need to unlock the value of cloud technologies in their organizations.Skills CoveredDigital transformation,  leadership,  management,  cloud governance model,  novel cloud services,  operational efficiencies,  cloud center of excellencePrerequisitesWord Processors, Spreadsheets, Presentation ToolsView more +Program DetailsDownload Syllabusintermediate2 MonthsProgram DetailsDownload Syllabus","https://www.udacity.com/course/cloud-computing-for-business-leaders-nanodegree--nd046","null","null"
"1668875199-46700","https://www.udacity.com/courses/all?field=school-of-business","Introduction to Digital Project Management","This course introduces the field of digital project management, while diving into relevant career paths and what exactly those paths entail. It also covers the basic structure on which digital projects are formed.","https://www.udacity.com/www-proxy/contentful/assets/2y9b3o528xhq/GvxpAoBA874OBwSdb9lMb/d80e6114fb1e63876597b9e39b8563c0/catalog-card-29.jpg","freeIntroduction to Digital Project ManagementThis course introduces the field of digital project management, while diving into relevant career paths and what exactly those paths entail. It also covers the basic structure on which digital projects are formed.Skills CoveredDigital project management basics,  project management skills,   project management lifecycleView more +Program Detailsbeginner1 WeekProgram Details","https://www.udacity.com/course/introduction-to-digital-project-management--ud043","null","null"
"1668875199-46701","https://www.udacity.com/courses/all?field=school-of-business","Getting Started with Google Workspace","Learn how to manage mail and schedules effectively. Create, manage and, share content in Google Drive and become more productive through the use of the collaboration features that are an integral and defining part of Google Workspace.","https://www.udacity.com/www-proxy/contentful/assets/2y9b3o528xhq/7FqeT3nCzgYagrlDdSGzmA/d7700e0cf29dfcd75bd84b2246348017/Google_Digital_Leader.jpg","freeGetting Started with Google WorkspaceLearn how to manage mail and schedules effectively. Create, manage and, share content in Google Drive and become more productive through the use of the collaboration features that are an integral and defining part of Google Workspace.Skills CoveredGmail,  Google Calendar,  Google Drive,  Google Docs,  Google Slides,  Google Meet,  Google Chat,  Google Forms,  Intermediate Spreadsheet Use,  Basic Spreadsheet UseView more +Program Detailsbeginner2 MonthsIn collaboration with:Google CloudProgram DetailsIn collaboration with:Google Cloud","https://www.udacity.com/course/getting-started-with-google-workspace--ud300","null","null"
"1668875199-46702","https://www.udacity.com/courses/all?field=school-of-business","Rapid Prototyping","Learning to prototype will save you time and money in the development process. You’ll create quality apps faster and have confidence in the viability of your products.","https://d20vrrgs8k4bvw.cloudfront.net/images/courses/thumbnails/ud723_thumbnail.jpg","freeRapid PrototypingLearning to prototype will save you time and money in the development process. You’ll create quality apps faster and have confidence in the viability of your products.Skills CoveredPrototyping, User Research, inVisionView more +Program Detailsintermediate3 WeeksIn collaboration with:GoogleProgram DetailsIn collaboration with:Google","https://www.udacity.com/course/rapid-prototyping--ud723","null","null"
"1668875199-46703","https://www.udacity.com/courses/all?field=school-of-business","Creating an Analytical Dataset","Learn how to prepare data to ensure the efficacy of your analysis while improving fluency in Alteryx.","https://d20vrrgs8k4bvw.cloudfront.net/images/courses/thumbnails/ud977_thumbnail.jpg","freeCreating an Analytical DatasetLearn how to prepare data to ensure the efficacy of your analysis while improving fluency in Alteryx.Skills CoveredData Issues, Data Formatting, Data BlendingView more +Program Detailsbeginner2 WeeksIn collaboration with:AlteryxProgram DetailsIn collaboration with:Alteryx","https://www.udacity.com/course/creating-an-analytical-dataset--ud977","null","null"
"1668875199-46704","https://www.udacity.com/courses/all?field=school-of-business","Problem Solving with Advanced Analytics","Learn a scientific approach to solving problems with data, a foundational skill for anyone interested in making data driven decisions in a business context.","https://d20vrrgs8k4bvw.cloudfront.net/images/courses/thumbnails/ud976_thumbnail.jpg","freeProblem Solving with Advanced AnalyticsLearn a scientific approach to solving problems with data, a foundational skill for anyone interested in making data driven decisions in a business context.Skills CoveredLinear RegressionView more +Program Detailsbeginner2 WeeksIn collaboration with:AlteryxProgram DetailsIn collaboration with:Alteryx","https://www.udacity.com/course/problem-solving-with-advanced-analytics--ud976","null","null"
"1668875199-46705","https://www.udacity.com/courses/all?field=school-of-business","Classification Models","Learn how to use classification predictive models to solve business problems involving non-numeric data.","https://d20vrrgs8k4bvw.cloudfront.net/images/courses/thumbnails/ud978_thumbnail.jpg","freeClassification ModelsLearn how to use classification predictive models to solve business problems involving non-numeric data.Skills CoveredBinary Classication Models, Non-Binary Classification ModelsView more +Program Detailsintermediate2 WeeksIn collaboration with:AlteryxProgram DetailsIn collaboration with:Alteryx","https://www.udacity.com/course/classification-models--ud978","null","null"
"1668875199-46706","https://www.udacity.com/courses/all?field=school-of-business","Product Design","Learn product validation, UI/UX practices, Google’s Design Sprint and the process for setting and tracking actionable metrics.","https://d20vrrgs8k4bvw.cloudfront.net/images/courses/thumbnails/ud509_thumbnail.jpg","freeProduct DesignLearn product validation, UI/UX practices, Google’s Design Sprint and the process for setting and tracking actionable metrics.Skills CoveredProduct Design, Design Sprints, Ideation and Validation, UI/UXView more +Program Detailsintermediate2 MonthsIn collaboration with:GoogleProgram DetailsIn collaboration with:Google","https://www.udacity.com/course/product-design--ud509","null","null"
"1668875199-46707","https://www.udacity.com/courses/all?field=school-of-business","Segmentation and Clustering","The Segmentation & Clustering course provides students with the knowledge to build and apply clustering models to develop sophisticated segmentation in business contexts.","https://d20vrrgs8k4bvw.cloudfront.net/images/courses/thumbnails/ud981_thumbnail.jpg","freeSegmentation and ClusteringThe Segmentation & Clustering course provides students with the knowledge to build and apply clustering models to develop sophisticated segmentation in business contexts.Skills CoveredVariable Reduction, Clustering Models designView more +Program Detailsintermediate3 WeeksProgram Details","https://www.udacity.com/course/segmentation-and-clustering--ud981","null","null"
"1668875199-46708","https://www.udacity.com/courses/all?field=school-of-business","Time Series Forecasting","The Time Series Forecasting course provides students with the foundational knowledge to build and apply time series forecasting models in a variety of business contexts.","https://d20vrrgs8k4bvw.cloudfront.net/images/courses/thumbnails/ud980_thumbnail.jpg","freeTime Series ForecastingThe Time Series Forecasting course provides students with the foundational knowledge to build and apply time series forecasting models in a variety of business contexts.Skills CoveredTime Series Forecasting, ETS Models, ARIMA ModelsView more +Program Detailsintermediate3 WeeksProgram Details","https://www.udacity.com/course/time-series-forecasting--ud980","null","null"
"1668875199-46709","https://www.udacity.com/courses/all?field=school-of-business","App Marketing","This course will help you organize a strategy of identifying your perfect user, and teach you how to grow your user base by focusing your product on their needs.","https://d20vrrgs8k4bvw.cloudfront.net/images/courses/thumbnails/ud719_thumbnail.jpg","freeApp MarketingThis course will help you organize a strategy of identifying your perfect user, and teach you how to grow your user base by focusing your product on their needs.Skills CoveredApp Marketing, User Segmentation, Customer AcquisitionView more +Program Detailsintermediate2 WeeksIn collaboration with:GoogleProgram DetailsIn collaboration with:Google","https://www.udacity.com/course/app-marketing--ud719","null","null"
"1668875199-46710","https://www.udacity.com/courses/all?field=school-of-business","App Monetization","Learn how to effectively develop, implement, and measure your monetization strategy, iterating on the model as appropriate.","https://d20vrrgs8k4bvw.cloudfront.net/images/courses/thumbnails/ud518_thumbnail.jpg","freeApp MonetizationLearn how to effectively develop, implement, and measure your monetization strategy, iterating on the model as appropriate.Skills CoveredProduct Design, Google AnalyticsView more +Program Detailsintermediate1 MonthIn collaboration with:GoogleProgram DetailsIn collaboration with:Google","https://www.udacity.com/course/app-monetization--ud518","null","null"
"1668875199-46711","https://www.udacity.com/courses/all?field=school-of-business","A/B Testing for Business Analysts","The A/B Testing course provides students with the foundational knowledge to design and analyze A/B tests to create business insights and support decision making.","https://d20vrrgs8k4bvw.cloudfront.net/images/courses/thumbnails/ud979_thumbnail.jpg","freeA/B Testing for Business AnalystsThe A/B Testing course provides students with the foundational knowledge to design and analyze A/B tests to create business insights and support decision making.Skills CoveredA/B Randomized Design Tests, A/B Matched Pair Design TestsView more +Program Detailsintermediate3 WeeksProgram Details","https://www.udacity.com/course/ab-testing--ud979","null","null"
"1668875199-46712","https://www.udacity.com/courses/all?field=school-of-business","How to Build a Startup","Learn what it takes to build a successful startup using the Customer Development process, where entrepreneurs ""get out of the building"" to gather and iterate on feedback.","https://d20vrrgs8k4bvw.cloudfront.net/images/courses/thumbnails/ep245_thumbnail.jpg","freeHow to Build a StartupLearn what it takes to build a successful startup using the Customer Development process, where entrepreneurs ""get out of the building"" to gather and iterate on feedback.Skills CoveredEntrepreneurship, Value Proposition, Revenue Models, Customer SegmentsView more +Program Detailsintermediate1 MonthProgram Details","https://www.udacity.com/course/how-to-build-a-startup--ep245","null","null"
"1668875199-46713","https://www.udacity.com/courses/all?field=school-of-business","Get Your Startup Started","Acquire the know-how necessary to see your business grow towards its next milestone.","https://d20vrrgs8k4bvw.cloudfront.net/images/courses/thumbnails/ud806_thumbnail.jpg","freeGet Your Startup StartedAcquire the know-how necessary to see your business grow towards its next milestone.Skills CoveredEntrepreneurship, BootstrappingView more +Program Detailsintermediate3 WeeksIn collaboration with:GoogleProgram DetailsIn collaboration with:Google","https://www.udacity.com/course/get-your-startup-started--ud806","null","null"
"1668875199-46714","https://www.udacity.com/courses/all?field=school-of-business","Managing Remote Teams with Upwork","Bring your remote-teams to the next level with hands-on skills to manage your remote workforce effectively.","https://d20vrrgs8k4bvw.cloudfront.net/images/course-catalog/en-us/ud942-catalog-image.png","freeManaging Remote Teams with UpworkBring your remote-teams to the next level with hands-on skills to manage your remote workforce effectively.Skills CoveredTeam Management, Workforce Training, Business Strategy, Agile Management, Remote WorkView more +Program Detailsbeginner1 HourIn collaboration with:UpworkProgram DetailsIn collaboration with:Upwork","https://www.udacity.com/course/managing-remote-teams-with-upwork--ud942","null","null"
"1668875202-46715","https://www.udacity.com/courses/all?field=school-of-autonomous-systems","C++","Get hands-on experience building five real-world projects in this popular general-purpose programming language.","https://d20vrrgs8k4bvw.cloudfront.net/images/degrees/nd213/nd-card.jpg","nanodegreeC++Get hands-on experience building five real-world projects in this popular general-purpose programming language.Skills CoveredData Structures & Algorithms, Memory Management, Concurrency, Object-oriented Programming, C++PrerequisitesIntermediate ProgrammingView more +Program DetailsDownload Syllabusintermediate4 Months4.5 stars 1121 reviewsProgram DetailsDownload Syllabus","https://www.udacity.com/course/c-plus-plus-nanodegree--nd213","4.5","1121"
"1668875202-46716","https://www.udacity.com/courses/all?field=school-of-autonomous-systems","Self-Driving Car Engineer","Learn the techniques that power self-driving cars across the full stack of a vehicle’s autonomous capabilities.","https://www.udacity.com/www-proxy/contentful/assets/2y9b3o528xhq/1B0YMCbwyXPPvAtOK2bbtG/ee405a76b8e2ee0903b6c4600647670a/catalog-card-11.jpg","nanodegreeSelf-Driving Car EngineerLearn the techniques that power self-driving cars across the full stack of a vehicle’s autonomous capabilities.Skills CoveredComputer Vision, Deep Learning, Sensor Fusion, Localization, Self-Driving Cars, Path Planning and ControlPrerequisitesPython, C++, Linear Algebra and CalculusView more +Program DetailsDownload Syllabusadvanced5 MonthsIn collaboration with:Waymo, Mercedes-BenzProgram DetailsDownload SyllabusIn collaboration with:Waymo, Mercedes-Benz","https://www.udacity.com/course/self-driving-car-engineer-nanodegree--nd0013","null","null"
"1668875202-46717","https://www.udacity.com/courses/all?field=school-of-autonomous-systems","Robotics Software Engineer","Build five hands-on projects to acquire core robotics software engineering skills: ROS, Gazebo, localization, mapping, SLAM, navigation, and path planning.","https://d20vrrgs8k4bvw.cloudfront.net/images/degrees/nd209/nd209_Robo_v2_card_image.png","nanodegreeRobotics Software EngineerBuild five hands-on projects to acquire core robotics software engineering skills: ROS, Gazebo, localization, mapping, SLAM, navigation, and path planning.Skills CoveredC++, ROS, Localization, Mapping, SLAM, Navigation, Path Planning, Robot Operating System, RoboticsPrerequisitesMathematics & ProgrammingView more +Program DetailsDownload Syllabusadvanced4 Months4.5 stars 571 reviewsProgram DetailsDownload Syllabus","https://www.udacity.com/course/robotics-software-engineer--nd209","4.5","571"
"1668875202-46718","https://www.udacity.com/courses/all?field=school-of-autonomous-systems","Intro to Self-Driving Cars","This introductory program is the perfect way to start your journey into the future of transportation—flying cars.","https://d20vrrgs8k4bvw.cloudfront.net/images/degrees/nd113/nd-card.jpg","nanodegreeIntro to Self-Driving CarsThis introductory program is the perfect way to start your journey into the future of transportation—flying cars.Skills CoveredComputer Vision, Machine Learning, Vehicle Motion, ControlPrerequisitesProgramming & MathematicsView more +Program DetailsDownload Syllabusintermediate4 Months4.6 stars 802 reviewsProgram DetailsDownload Syllabus","https://www.udacity.com/course/intro-to-self-driving-cars--nd113","4.6","802"
"1668875202-46719","https://www.udacity.com/courses/all?field=school-of-autonomous-systems","Sensor Fusion Engineer","Learn to fuse lidar point clouds, radar signatures, and camera images using Kalman Filters to detect and track vehicles and pedestrians over time.","https://d20vrrgs8k4bvw.cloudfront.net/images/degrees/nd313/nd-card.png","nanodegreeSensor Fusion EngineerLearn to fuse lidar point clouds, radar signatures, and camera images using Kalman Filters to detect and track vehicles and pedestrians over time.Skills CoveredPerception, Lidar, Radar, Sensors, Computer VisionPrerequisitesIntermediate C++, Calculus, and ProbabilityView more +Program DetailsDownload Syllabusadvanced4 Months4.7 stars 299 reviewsIn collaboration with:Mercedes-BenzProgram DetailsDownload SyllabusIn collaboration with:Mercedes-Benz","https://www.udacity.com/course/sensor-fusion-engineer-nanodegree--nd313","4.7","299"
"1668875202-46720","https://www.udacity.com/courses/all?field=school-of-autonomous-systems","Flying Car and Autonomous Flight Engineer","Master job-ready autonomous flight software engineering skills as you tackle advanced challenges, write real code for real aircraft, and develop a systems understanding of the Flying Car full-stack.","https://d20vrrgs8k4bvw.cloudfront.net/images/degrees/nd787/nd-card.jpg","nanodegreeFlying Car and Autonomous Flight EngineerMaster job-ready autonomous flight software engineering skills as you tackle advanced challenges, write real code for real aircraft, and develop a systems understanding of the Flying Car full-stack.Skills Covered3D Motion Planning, Controls, Estimation, Kalman FiltersPrerequisitesMathematics & ProgrammingView more +Program DetailsDownload Syllabusadvanced6 Months4.6 stars 254 reviewsProgram DetailsDownload Syllabus","https://www.udacity.com/course/flying-car-nanodegree--nd787","4.6","254"
"1668875202-46721","https://www.udacity.com/courses/all?field=school-of-autonomous-systems","Digital Freelancer","The goal of the Digital Freelancer Nanodegree program is to prepare students to enter the digital marketplace by teaching key skills to create a successful digital business. Students will learn freelancing basics and essential skills as well as how to build their personal brand to start a successful online business in the global freelancing marketplace.","https://www.udacity.com/www-proxy/contentful/assets/2y9b3o528xhq/3U3CiG1FnKGer0emHpwh1N/00ce8f98e0c65bc0f12f304a07373fb5/catalog-card-13.jpg","nanodegreeDigital FreelancerThe goal of the Digital Freelancer Nanodegree program is to prepare students to enter the digital marketplace by teaching key skills to create a successful digital business. Students will learn freelancing basics and essential skills as well as how to build their personal brand to start a successful online business in the global freelancing marketplace.Skills CoveredPortfolio Websites,  Professional Networking,  Resumes,  Social Media Presence,  Non-Disclosure Agreements,  Service Agreements,  Freelance Pricing Frameworks,  Invoicing,  Brand Design,  Elevator pitches,  Formal Written Communication,  Project management tools,  Project scopingPrerequisitesBasic computer skillsView more +Program DetailsDownload Syllabusbeginner1 MonthProgram DetailsDownload Syllabus","https://www.udacity.com/course/digital-freelancer-nanodegree--nd083","null","null"
"1668875202-46722","https://www.udacity.com/courses/all?field=school-of-autonomous-systems","Cyber-Physical Systems Design & Analysis","This course provides an introduction to cyber-physical systems with an industrial perspective.","https://d20vrrgs8k4bvw.cloudfront.net/images/courses/thumbnails/ud9876_thumbnail.jpg","freeCyber-Physical Systems Design & AnalysisThis course provides an introduction to cyber-physical systems with an industrial perspective.View more +Program Detailsadvanced16 WeeksIn collaboration with:Georgia Institute of TechnologyProgram DetailsIn collaboration with:Georgia Institute of Technology","https://www.udacity.com/course/cyber-physical-systems-design-analysis--ud9876","null","null"
"1668875202-46723","https://www.udacity.com/courses/all?field=school-of-autonomous-systems","Differential Equations in Action","Write Python code to find numerical solutions to systems of differential equations. The models you create will fight wildfires, bring spaceships back to earth, and more!","https://d20vrrgs8k4bvw.cloudfront.net/images/courses/thumbnails/cs222_thumbnail.jpg","freeDifferential Equations in ActionWrite Python code to find numerical solutions to systems of differential equations. The models you create will fight wildfires, bring spaceships back to earth, and more!Skills CoveredMath, Differential EquationsView more +Program Detailsintermediate2 MonthsProgram Details","https://www.udacity.com/course/differential-equations-in-action--cs222","null","null"
"1668875202-46724","https://www.udacity.com/courses/all?field=school-of-autonomous-systems","Self-Driving Fundamentals: Featuring Apollo","Identify key parts of self-driving cars, utilize Apollo HD Map, localization, perception, prediction, planning and control, and start the learning path of building a self-driving car.","https://d20vrrgs8k4bvw.cloudfront.net/images/courses/thumbnails/ud0419_thumbnail.jpg","freeSelf-Driving Fundamentals: Featuring Apollo Identify key parts of self-driving cars, utilize Apollo HD Map, localization, perception, prediction, planning and control, and start the learning path of building a self-driving car. Skills CoveredApollo HD Map, Localization, Perception, Prediction, Planning, ControlView more +Program Detailsbeginner4 WeeksIn collaboration with:BaiduProgram DetailsIn collaboration with:Baidu","https://www.udacity.com/course/self-driving-car-fundamentals-featuring-apollo--ud0419","null","null"
"1668875204-46725","https://www.udacity.com/courses/all?field=school-of-ai","Deep Learning","Deep learning is driving advances in artificial intelligence that are changing our world—enroll now and learn to build and apply your own deep neural networks.","https://www.udacity.com/www-proxy/contentful/assets/2y9b3o528xhq/3iq8QEHIjr2lUYgmDMgeEX/67bd4529c488820a9672a393dfa2ca39/catalog-card-28.jpg","nanodegreeDeep LearningDeep learning is driving advances in artificial intelligence that are changing our world—enroll now and learn to build and apply your own deep neural networks.Skills CoveredNeural Networks,  Perceptron,  Autoencoders,  Convolutional Neural Networks,  PyTorch,  Object Detection,  Recurrent Neural Networks,  Long-short term Memory Networks,  Backpropagation,  Generative Adversarial Networks,  Deep Learning Techniques,  Image Generation,  Hyperparameter TuningPrerequisitesIntermediate PythonView more +Program DetailsDownload Syllabusintermediate4 Months4.7 stars 3367 reviewsProgram DetailsDownload Syllabus","https://www.udacity.com/course/deep-learning-nanodegree--nd101","4.7","3367"
"1668875204-46726","https://www.udacity.com/courses/all?field=school-of-ai","Artificial Intelligence for Trading","Complete real-world projects designed by industry experts, covering topics from asset management to trading signal generation. Master AI algorithms for trading, and build your career-ready portfolio.","https://d20vrrgs8k4bvw.cloudfront.net/images/open-graph/en-US/AI_for_trading_Background.png","nanodegreeArtificial Intelligence for TradingComplete real-world projects designed by industry experts, covering topics from asset management to trading signal generation. Master AI algorithms for trading, and build your career-ready portfolio.Skills CoveredMomentum Trading Strategy, Smart Beta, Alpha Factors, Natural Language Processing, Deep Learning, Neural NetworksPrerequisitesPython & MathematicsView more +Program DetailsDownload Syllabusintermediate6 Months4.6 stars 788 reviewsIn collaboration with:WorldQuantProgram DetailsDownload SyllabusIn collaboration with:WorldQuant","https://www.udacity.com/course/ai-for-trading--nd880","4.6","788"
"1668875204-46727","https://www.udacity.com/courses/all?field=school-of-ai","Machine Learning DevOps Engineer","Gain the DevOps skills required to automate the various aspects and stages of building and monitoring machine learning models.","https://www.udacity.com/www-proxy/contentful/assets/2y9b3o528xhq/7vsenFxZEguVh1GwD4zXtR/c1193513dd4f28db7405a4c11628c45b/catalog-card-10.jpg","nanodegreeMachine Learning DevOps EngineerGain the DevOps skills required to automate the various aspects and stages of building and monitoring machine learning models.Skills CoveredAPI development,  Automated model scoring,  CI/CD,  Model testing,  Data Version Control,  Machine Learning PipelinesPrerequisitesPrior experience with Python and Machine LearningView more +Program DetailsDownload Syllabusadvanced4 Months4.6 stars 114 reviewsProgram DetailsDownload Syllabus","https://www.udacity.com/course/machine-learning-dev-ops-engineer-nanodegree--nd0821","4.6","114"
