web-scraper-order,web-scraper-start-url,name,description,image-src,link,link-href,rating,review-count
"1668875189-46517","https://www.udacity.com/courses/all?field=school-of-programming","Advanced Android App Development","Make your app production-ready by applying advanced features like library integration, material design, widgets, receiving cloud messages, and more!","https://d20vrrgs8k4bvw.cloudfront.net/images/courses/thumbnails/ud855_thumbnail.jpg","freeAdvanced Android App DevelopmentMake your app production-ready by applying advanced features like library integration, material design, widgets, receiving cloud messages, and more!Skills CoveredAndroid Development, Fragments, Libraries, Firebase, EspressoView more +Program Detailsadvanced6 WeeksIn collaboration with:GoogleProgram DetailsIn collaboration with:Google","https://www.udacity.com/course/advanced-android-app-development--ud855","null","null"
"1668875189-46518","https://www.udacity.com/courses/all?field=school-of-programming","Software Architecture & Design","Software Architecture and Design teaches the principles and concepts involved in the analysis and design of large software systems.","https://d20vrrgs8k4bvw.cloudfront.net/images/courses/thumbnails/ud821_thumbnail.jpg","freeSoftware Architecture & DesignSoftware Architecture and Design teaches the principles and concepts involved in the analysis and design of large software systems.Skills CoveredUnified Modeling Language, Object Constraint Language, Software Architecture, Software Design, Code ReviewView more +Program Detailsintermediate2 MonthsIn collaboration with:Georgia Institute of TechnologyProgram DetailsIn collaboration with:Georgia Institute of Technology","https://www.udacity.com/course/software-architecture-design--ud821","null","null"
"1668875189-46519","https://www.udacity.com/courses/all?field=school-of-programming","Authentication & Authorization: OAuth","Learn to implement the OAuth 2.0 framework to allow users to securely and easily login to your web applications.","https://d20vrrgs8k4bvw.cloudfront.net/images/courses/thumbnails/ud330_thumbnail.jpg","freeAuthentication & Authorization: OAuthLearn to implement the OAuth 2.0 framework to allow users to securely and easily login to your web applications.Skills CoveredFlask, OAuth 2.0, Authentication & Authorization, PythonView more +Program Detailsintermediate2 WeeksProgram Details","https://www.udacity.com/course/authentication-authorization-oauth--ud330","null","null"
"1668875189-46520","https://www.udacity.com/courses/all?field=school-of-programming","Intro to iOS App Development with Swift","Take the first step in becoming an iOS Developer by learning about Swift and writing your first app.","https://d20vrrgs8k4bvw.cloudfront.net/images/courses/thumbnails/ud585_thumbnail.jpg","freeIntro to iOS App Development with SwiftTake the first step in becoming an iOS Developer by learning about Swift and writing your first app.Skills CoveredSwift, UIKit, AVFoundationView more +Program Detailsintermediate1 MonthProgram Details","https://www.udacity.com/course/intro-to-ios-app-development-with-swift--ud585","null","null"
"1668875189-46521","https://www.udacity.com/courses/all?field=school-of-programming","Introduction to Operating Systems","Introduction to Operating Systems teaches the basic operating system abstractions, mechanisms, and their implementations.","https://d20vrrgs8k4bvw.cloudfront.net/images/courses/thumbnails/ud923_thumbnail.jpg","freeIntroduction to Operating SystemsIntroduction to Operating Systems teaches the basic operating system abstractions, mechanisms, and their implementations.Skills CoveredProcesses & Threads, Memory Management, Inter-Process Communication, Resource Virtualization, Distributed File SystemsView more +Program Detailsintermediate2 MonthsIn collaboration with:Georgia Institute of TechnologyProgram DetailsIn collaboration with:Georgia Institute of Technology","https://www.udacity.com/course/introduction-to-operating-systems--ud923","null","null"
"1668875189-46522","https://www.udacity.com/courses/all?field=school-of-programming","Android Basics: Networking","This class teaches the basics of networking using Android, and is a part of the Android Basics Nanodegree by Google.","https://d20vrrgs8k4bvw.cloudfront.net/images/courses/thumbnails/ud843_thumbnail.jpg","freeAndroid Basics: NetworkingThis class teaches the basics of networking using Android, and is a part of the Android Basics Nanodegree by Google.Skills CoveredAndroid Development, JSON Parsing, HTTP Networking, Threads and Parallelism, Control Flow and Conditionals, PreferencesView more +Program Detailsbeginner5 WeeksIn collaboration with:GoogleProgram DetailsIn collaboration with:Google","https://www.udacity.com/course/android-basics-networking--ud843","null","null"
"1668875189-46523","https://www.udacity.com/courses/all?field=school-of-programming","Web Accessibility","Get hands-on experience making web applications accessible. You’ll understand when and why users need accessibility, then you’ll dive into how to implement.","https://d20vrrgs8k4bvw.cloudfront.net/images/courses/thumbnails/ud891_thumbnail.jpg","freeWeb AccessibilityGet hands-on experience making web applications accessible. You’ll understand when and why users need accessibility, then you’ll dive into how to implement.Skills CoveredAccessibility, Screen Readers, Focus, Semantics, ARIAView more +Program Detailsadvanced2 WeeksIn collaboration with:GoogleProgram DetailsIn collaboration with:Google","https://www.udacity.com/course/web-accessibility--ud891","null","null"
"1668875189-46524","https://www.udacity.com/courses/all?field=school-of-programming","Android Basics: Data Storage","In this course, you'll learn the basics of data storage in Android, building your first database and an app that could be used for any small business!","https://d20vrrgs8k4bvw.cloudfront.net/images/courses/thumbnails/ud845_thumbnail.jpg","freeAndroid Basics: Data StorageIn this course, you'll learn the basics of data storage in Android, building your first database and an app that could be used for any small business!Skills CoveredAndroid Development, SQLite, ContentProvider, CursorAdapter & CursorLoader, Database, DesignView more +Program Detailsbeginner8 WeeksIn collaboration with:GoogleProgram DetailsIn collaboration with:Google","https://www.udacity.com/course/android-basics-data-storage--ud845","null","null"
"1668875189-46525","https://www.udacity.com/courses/all?field=school-of-programming","Scalable Microservices with Kubernetes","This course is designed to teach you about managing microservices, using Kubernetes. This course is built in partnership with experts such as Google’s Kelsey Hightower.","https://d20vrrgs8k4bvw.cloudfront.net/images/courses/thumbnails/ud615_thumbnail.jpg","freeScalable Microservices with KubernetesThis course is designed to teach you about managing microservices, using Kubernetes. This course is built in partnership with experts such as Google’s Kelsey Hightower.Skills CoveredMicroservices, Docker, Kubernetes, Deploying MicroservicesView more +Program Detailsintermediate1 MonthIn collaboration with:GoogleProgram DetailsIn collaboration with:Google","https://www.udacity.com/course/scalable-microservices-with-kubernetes--ud615","null","null"
"1668875189-46526","https://www.udacity.com/courses/all?field=school-of-programming","Developing Android Apps with Kotlin","Learn the fundamentals of the Kotlin programming language from Kotlin experts at Google.","https://d20vrrgs8k4bvw.cloudfront.net/images/courses/thumbnails/ud9012_catalog.png","freeDeveloping Android Apps with KotlinLearn the fundamentals of the Kotlin programming language from Kotlin experts at Google.Skills CoveredAndroid DevelopmentView more +Program Detailsintermediate2 MonthsIn collaboration with:GoogleProgram DetailsIn collaboration with:Google","https://www.udacity.com/course/developing-android-apps-with-kotlin--ud9012","null","null"
"1668875189-46527","https://www.udacity.com/courses/all?field=school-of-programming","Browser Rendering Optimization","This course will demystify the browser's rendering pipeline and make it easy for you to build high performance web apps.","https://d20vrrgs8k4bvw.cloudfront.net/images/courses/thumbnails/ud860_thumbnail.jpg","freeBrowser Rendering OptimizationThis course will demystify the browser's rendering pipeline and make it easy for you to build high performance web apps.Skills CoveredBrowser Rendering Response, Animation, Idle and Load (RAIL), Optimizing JavaScript, How to debug an appView more +Program Detailsadvanced1 MonthIn collaboration with:GoogleProgram DetailsIn collaboration with:Google","https://www.udacity.com/course/browser-rendering-optimization--ud860","null","null"
"1668875189-46528","https://www.udacity.com/courses/all?field=school-of-programming","Learn Swift Programming Syntax","This course focuses on the syntax of the Swift programming language. By the end of the course, you'll be able to apply Swift essentials to building iOS apps.","https://d20vrrgs8k4bvw.cloudfront.net/images/courses/thumbnails/ud902_thumbnail.jpg","freeLearn Swift Programming SyntaxThis course focuses on the syntax of the Swift programming language. By the end of the course, you'll be able to apply Swift essentials to building iOS apps.Skills CoveredVariables and Constants, Control Flow, Functions, Optionals, OOPView more +Program Detailsintermediate3 WeeksProgram Details","https://www.udacity.com/course/learn-swift-programming-syntax--ud902","null","null"
"1668875189-46529","https://www.udacity.com/courses/all?field=school-of-programming","Offline Web Applications","Learn how to develop offline-first web application using Service Workers and IndexedDB.","https://d20vrrgs8k4bvw.cloudfront.net/images/courses/thumbnails/ud899_thumbnail.jpg","freeOffline Web ApplicationsLearn how to develop offline-first web application using Service Workers and IndexedDB.Skills CoveredDeveloping offline-first applications, Understanding Lie-Fi, Service Worker DevTools, IndexedDB, IndexedDB asset cachingView more +Program Detailsintermediate3 WeeksIn collaboration with:GoogleProgram DetailsIn collaboration with:Google","https://www.udacity.com/course/offline-web-applications--ud899","null","null"
"1668875189-46530","https://www.udacity.com/courses/all?field=school-of-programming","Kotlin for Android Developers","Take an Android app in Java and convert it to Kotlin, learning key features of the Kotlin programming language along the way.","https://d20vrrgs8k4bvw.cloudfront.net/images/courses/thumbnails/ud888_thumbnail.jpg","freeKotlin for Android DevelopersTake an Android app in Java and convert it to Kotlin, learning key features of the Kotlin programming language along the way.Skills CoveredKotlin, AndroidView more +Program Detailsadvanced1 WeekProgram Details","https://www.udacity.com/course/kotlin-for-android-developers--ud888","null","null"
"1668875189-46531","https://www.udacity.com/courses/all?field=school-of-programming","UX Design for Mobile Developers","This is a design course made for developers. You'll learn UX design skills which will help you make 5-star mobile apps that your users will love.","https://d20vrrgs8k4bvw.cloudfront.net/images/courses/thumbnails/ud849_thumbnail.jpg","freeUX Design for Mobile DevelopersThis is a design course made for developers. You'll learn UX design skills which will help you make 5-star mobile apps that your users will love.Skills CoveredAndroid, UX Design, User-Centered DesignView more +Program Detailsbeginner6 WeeksIn collaboration with:GoogleProgram DetailsIn collaboration with:Google","https://www.udacity.com/course/ux-design-for-mobile-developers--ud849","null","null"
"1668875189-46532","https://www.udacity.com/courses/all?field=school-of-programming","Software Development Process","Software Development Processes explores requirements engineering, architecture and design, testing, and software quality in general.","https://d20vrrgs8k4bvw.cloudfront.net/images/courses/thumbnails/ud805_thumbnail.jpg","freeSoftware Development ProcessSoftware Development Processes explores requirements engineering, architecture and design, testing, and software quality in general.Skills CoveredSoftware Development Life Cycle, Requirements Engineering, Design Patterns, Black-Box & White-Box Testing, Agile Development MethodologyView more +Program Detailsintermediate3 MonthsIn collaboration with:Georgia Institute of TechnologyProgram DetailsIn collaboration with:Georgia Institute of Technology","https://www.udacity.com/course/software-development-process--ud805","null","null"
"1668875189-46533","https://www.udacity.com/courses/all?field=school-of-programming","Data Visualization in Tableau","Learn the fundamentals of data visualization and practice communicating with data.","https://d20vrrgs8k4bvw.cloudfront.net/images/courses/thumbnails/ud1006_thumbnail.jpg","freeData Visualization in TableauLearn the fundamentals of data visualization and practice communicating with data.Skills CoveredTableau, Design of Visualizations, Visual EncodingsView more +Program Detailsbeginner3 WeeksProgram Details","https://www.udacity.com/course/data-visualization-in-tableau--ud1006","null","null"
"1668875189-46534","https://www.udacity.com/courses/all?field=school-of-programming","Intro to Progressive Web Apps","In this course you’ll get started working on your very first Progressive Web App (PWA) - a web app that can take advantage of many features native applications have enjoyed!","https://d20vrrgs8k4bvw.cloudfront.net/images/courses/thumbnails/ud811_thumbnail.jpg","freeIntro to Progressive Web AppsIn this course you’ll get started working on your very first Progressive Web App (PWA) - a web app that can take advantage of many features native applications have enjoyed!Skills CoveredProgressive Web Apps, Service Workers, Web App Manifest, Offline appsView more +Program Detailsintermediate2 WeeksIn collaboration with:GoogleProgram DetailsIn collaboration with:Google","https://www.udacity.com/course/intro-to-progressive-web-apps--ud811","null","null"
"1668875189-46535","https://www.udacity.com/courses/all?field=school-of-programming","Writing READMEs","Documentation is an important part of the development process. Learn to write READMEs using Markdown so your code can be used by other humans!","https://d20vrrgs8k4bvw.cloudfront.net/images/courses/thumbnails/ud777_thumbnail.jpg","freeWriting READMEsDocumentation is an important part of the development process. Learn to write READMEs using Markdown so your code can be used by other humans!Skills CoveredREADME, Markdown, Making code easier to readView more +Program Detailsbeginner3 DaysProgram Details","https://www.udacity.com/course/writing-readmes--ud777","null","null"
"1668875189-46536","https://www.udacity.com/courses/all?field=school-of-programming","Software Analysis & Testing","This course covers the theory and practice of software analysis, which is at the heart of software development processes such as diagnosing bugs, testing, and debugging.","https://d20vrrgs8k4bvw.cloudfront.net/images/courses/thumbnails/ud333_thumbnail.jpg","freeSoftware Analysis & TestingThis course covers the theory and practice of software analysis, which is at the heart of software development processes such as diagnosing bugs, testing, and debugging.Skills CoveredSoftware Testing, Debugging, Dataflow Analysis, Constraint-based Analysis, Symbolic ExecutionView more +Program Detailsintermediate16 WeeksIn collaboration with:Georgia Institute of TechnologyProgram DetailsIn collaboration with:Georgia Institute of Technology","https://www.udacity.com/course/software-analysis-testing--ud333","null","null"
"1668875189-46537","https://www.udacity.com/courses/all?field=school-of-programming","iOS Persistence and Core Data","Persisting data is a core skill for any iOS developer. Learn how to store app data to your device using three common techniques: NSUserDefaults, Sandbox, and Core Data.","https://d20vrrgs8k4bvw.cloudfront.net/images/courses/thumbnails/ud325_thumbnail.jpg","freeiOS Persistence and Core DataPersisting data is a core skill for any iOS developer. Learn how to store app data to your device using three common techniques: NSUserDefaults, Sandbox, and Core Data.Skills CoveredData Persistence, Core Data, UserDefaults, FileManagerView more +Program Detailsadvanced2 MonthsProgram Details","https://www.udacity.com/course/ios-persistence-and-core-data--ud325","null","null"
"1668875189-46538","https://www.udacity.com/courses/all?field=school-of-programming","Computer Networking","This is an advanced Computer Networking course that delves into the latest concepts and tools used by the CN industry.","https://d20vrrgs8k4bvw.cloudfront.net/images/courses/thumbnails/ud436_thumbnail.jpg","freeComputer NetworkingThis is an advanced Computer Networking course that delves into the latest concepts and tools used by the CN industry.Skills CoveredSoftware-Defined Networking, Data Center Networking, Content Distribution, Congestion Control, Traffic ShapingView more +Program Detailsintermediate3 MonthsIn collaboration with:Georgia Institute of TechnologyProgram DetailsIn collaboration with:Georgia Institute of Technology","https://www.udacity.com/course/computer-networking--ud436","null","null"
"1668875189-46539","https://www.udacity.com/courses/all?field=school-of-programming","Firebase Analytics: iOS","Learn how to grow an app's user base using Firebase Analytics, a free and unlimited analytics solution","https://d20vrrgs8k4bvw.cloudfront.net/images/courses/thumbnails/ud353_thumbnail.jpg","freeFirebase Analytics: iOSLearn how to grow an app's user base using Firebase Analytics, a free and unlimited analytics solutionSkills CoveredAndroid Development, Firebase Analytics, Firebase Crash Reporting, Firebase Remote Config, Firebase Dynamic LinksView more +Program Detailsintermediate1 DayIn collaboration with:GoogleProgram DetailsIn collaboration with:Google","https://www.udacity.com/course/firebase-analytics-ios--ud353","null","null"
"1668875189-46540","https://www.udacity.com/courses/all?field=school-of-programming","Human-Computer Interaction","This course is an introductory course on human-computer interaction, covering the principles, techniques, and open areas of development in HCI.","https://d20vrrgs8k4bvw.cloudfront.net/images/courses/thumbnails/ud400_thumbnail.jpg","freeHuman-Computer InteractionThis course is an introductory course on human-computer interaction, covering the principles, techniques, and open areas of development in HCI.Skills CoveredDesign Principles, Direct Manipulation Interfaces, Mental Models, Distributed Cognition, PrototypingView more +Program Detailsintermediate16 WeeksIn collaboration with:Georgia Institute of TechnologyProgram DetailsIn collaboration with:Georgia Institute of Technology","https://www.udacity.com/course/human-computer-interaction--ud400","null","null"
"1668875189-46541","https://www.udacity.com/courses/all?field=school-of-programming","2D Game Development with libGDX","This course explores how to use LibGDX to build 2D games that run anywhere, from web browsers to mobile devices. At the end you will create a full game, called Icicles.","https://d20vrrgs8k4bvw.cloudfront.net/images/courses/thumbnails/ud405_thumbnail.jpg","free2D Game Development with libGDXThis course explores how to use LibGDX to build 2D games that run anywhere, from web browsers to mobile devices. At the end you will create a full game, called Icicles.Skills CoveredLibGDX, Game Development, 2DView more +Program Detailsintermediate8 WeeksIn collaboration with:Amazon Appstore for AndroidProgram DetailsIn collaboration with:Amazon Appstore for Android","https://www.udacity.com/course/2d-game-development-with-libgdx--ud405","null","null"
"1668875189-46542","https://www.udacity.com/courses/all?field=school-of-programming","Intro to jQuery","Learn how to access and modify the DOM with ease using jQuery!","https://d20vrrgs8k4bvw.cloudfront.net/images/courses/thumbnails/ud245_thumbnail.jpg","freeIntro to jQueryLearn how to access and modify the DOM with ease using jQuery!Skills CoveredjQuery, DOM Structure, Reading jQuery documentation, Modify HTML attributes and contentView more +Program Detailsintermediate2 DaysProgram Details","https://www.udacity.com/course/intro-to-jquery--ud245","null","null"
"1668875189-46543","https://www.udacity.com/courses/all?field=school-of-programming","How to create <anything> in Android","Learn to implement the newest Android user interface components while building apps in Android Studio.","https://d20vrrgs8k4bvw.cloudfront.net/images/courses/thumbnails/ud802_thumbnail.jpg","freeHow to create <anything> in AndroidLearn to implement the newest Android user interface components while building apps in Android Studio.Skills CoveredAndroid, UI, App DevelopmentView more +Program Detailsbeginner4 WeeksProgram Details","https://www.udacity.com/course/how-to-create-anything-in-android--ud802","null","null"
"1668875189-46544","https://www.udacity.com/courses/all?field=school-of-programming","Introduction to Graduate Algorithms","Learn advanced techniques for designing algorithms and apply them to hard computational problems.","https://www.udacity.com/www-proxy/contentful/assets/2y9b3o528xhq/2XDIKTVb7GnCFj4gusYCuS/558da8b0e00c775132c4674e7a8773a4/nd-card.jpg","freeIntroduction to Graduate AlgorithmsLearn advanced techniques for designing algorithms and apply them to hard computational problems.View more +Program Detailsadvanced3 MonthsIn collaboration with:Georgia Institute of TechnologyProgram DetailsIn collaboration with:Georgia Institute of Technology","https://www.udacity.com/course/introduction-to-graduate-algorithms--ud401","null","null"
"1668875189-46545","https://www.udacity.com/courses/all?field=school-of-programming","Dynamic Web Applications with Sinatra","Sinatra is a micro-framework for quickly developing small Ruby applications for the web. In this course, you'll learn all about Sinatra, routing, and templating.","https://d20vrrgs8k4bvw.cloudfront.net/images/courses/thumbnails/ud268_thumbnail.jpg","freeDynamic Web Applications with SinatraSinatra is a micro-framework for quickly developing small Ruby applications for the web. In this course, you'll learn all about Sinatra, routing, and templating.Skills CoveredRuby, Sinatra, Building web applicationsView more +Program Detailsintermediate2 WeeksProgram Details","https://www.udacity.com/course/dynamic-web-applications-with-sinatra--ud268","null","null"
"1668875189-46546","https://www.udacity.com/courses/all?field=school-of-programming","How to Make a Platformer Using libGDX","This course will explore how to create a game called Giga Gal. Giga Gal is a platformer in which you run, collect energy packs, jump a bunch, and shoot enemies.","https://d20vrrgs8k4bvw.cloudfront.net/images/courses/thumbnails/ud406_thumbnail.jpg","freeHow to Make a Platformer Using libGDXThis course will explore how to create a game called Giga Gal. Giga Gal is a platformer in which you run, collect energy packs, jump a bunch, and shoot enemies.Skills CoveredLibGDX, Game Development, Asset managementView more +Program Detailsintermediate8 WeeksIn collaboration with:Amazon Appstore for AndroidProgram DetailsIn collaboration with:Amazon Appstore for Android","https://www.udacity.com/course/how-to-make-a-platformer-using-libgdx--ud406","null","null"
"1668875189-46547","https://www.udacity.com/courses/all?field=school-of-programming","JavaScript Testing","Learn how to iterate on your web applications with confidence using the red-green-refactor workflow cycle and automated testing frameworks.","https://d20vrrgs8k4bvw.cloudfront.net/images/courses/thumbnails/ud549_thumbnail.jpg","freeJavaScript TestingLearn how to iterate on your web applications with confidence using the red-green-refactor workflow cycle and automated testing frameworks.Skills CoveredJavascript Apps, Jasmine testing framework, red-green-refactor workflowView more +Program Detailsintermediate2 WeeksProgram Details","https://www.udacity.com/course/javascript-testing--ud549","null","null"
"1668875189-46548","https://www.udacity.com/courses/all?field=school-of-programming","Object-Oriented JavaScript","","https://d20vrrgs8k4bvw.cloudfront.net/images/courses/thumbnails/ud711_thumbnail.jpg","freeObject-Oriented JavaScriptSkills CoveredObject Oriented Javascript, Object-oriented programming, Data and functionality, Prototypal inheritanceView more +Program Detailsintermediate3 WeeksProgram Details","https://www.udacity.com/course/object-oriented-javascript--ud711","null","null"
"1668875189-46549","https://www.udacity.com/courses/all?field=school-of-programming","Localization Essentials","Localization is about making a product feel tailored to users around the world. Specifically, it is the process of adapting a product to a language, culture and market.","https://d20vrrgs8k4bvw.cloudfront.net/images/courses/thumbnails/ud610_thumbnail.jpg","freeLocalization EssentialsLocalization is about making a product feel tailored to users around the world. Specifically, it is the process of adapting a product to a language, culture and market.Skills CoveredLocalization, Google Translator Toolkit, Localization at GoogleView more +Program Detailsbeginner2 WeeksIn collaboration with:GoogleProgram DetailsIn collaboration with:Google","https://www.udacity.com/course/localization-essentials--ud610","null","null"
