web-scraper-order,web-scraper-start-url,name,description,image-src,link,link-href,rating,review-count
"1668875191-46619","https://www.udacity.com/courses/all?field=school-of-product-management","Data Product Manager","Apply data science best practices to build products that deliver the right experience to the right users—at the right time.","https://d20vrrgs8k4bvw.cloudfront.net/images/degrees/nd030/catalog+image+nd030.jpg","nanodegreeData Product ManagerApply data science best practices to build products that deliver the right experience to the right users—at the right time.Skills CoveredData Science, Product Management, Product Design, Data Visualization, User Journey MapsPrerequisitesPrior Data Analysis & Product Management Experience RecommendedView more +Program DetailsDownload Syllabusintermediate3 Months4.3 stars 218 reviewsProgram DetailsDownload Syllabus","https://www.udacity.com/course/data-product-manager-nanodegree--nd030","4.3","218"
"1668875191-46620","https://www.udacity.com/courses/all?field=school-of-product-management","Growth Product Manager","Lead experimentation and data-driven decision-making to drive products to the next level of scale, impact, and profitability.","https://www.udacity.com/www-proxy/contentful/assets/2y9b3o528xhq/3GhXrZk7J81BTX0hWotSVs/476937f0d67566feb2d332022eb20225/catalog-card-15.jpg","nanodegreeGrowth Product ManagerLead experimentation and data-driven decision-making to drive products to the next level of scale, impact, and profitability.Skills CoveredAcquisition Strategy,  Growth Loops,  Product Management,  Activation Metrics,  Growth Strategy,  Activation Strategy,  Product Monetization Strategy,  Product Monetization Metrics,  Premium Value,  Cohort Analysis,  Experiment Design,  Target Personas,  Customer Acquisition Cost,  User Journey MapsPrerequisitesPrior Product Management Experience recommendedView more +Program DetailsDownload Syllabusintermediate3 MonthsProgram DetailsDownload Syllabus","https://www.udacity.com/course/growth-product-manager-nanodegree--nd037","null","null"
"1668875191-46621","https://www.udacity.com/courses/all?field=school-of-product-management","AI Product Manager","Develop AI products that deliver real business value by building skills that help you compete in the new AI-powered world.","https://d20vrrgs8k4bvw.cloudfront.net/images/degrees/nd088/nd-card.png","nanodegreeAI Product ManagerDevelop AI products that deliver real business value by building skills that help you compete in the new AI-powered world.Skills CoveredAI Products, Training ML Models, Annotating Datasets, Prototyping a ProductPrerequisitesNo Experience RequiredView more +Program DetailsDownload Syllabusbeginner2 Months4.4 stars 614 reviewsIn collaboration with:AppenProgram DetailsDownload SyllabusIn collaboration with:Appen","https://www.udacity.com/course/ai-product-manager-nanodegree--nd088","4.4","614"
"1668875191-46622","https://www.udacity.com/courses/all?field=school-of-product-management","Agile Software Development","Get equipped with the skills you need to guide the delivery of high value products with top notch software development teams.","https://d20vrrgs8k4bvw.cloudfront.net/images/degrees/nd144/nd144-catalog-card.jpg","nanodegreeAgile Software DevelopmentGet equipped with the skills you need to guide the delivery of high value products with top notch software development teams.
Skills CoveredAgile, Scrum, Kanban, XP, Minimum Viable ProductPrerequisitesNo Experience RequiredView more +Program DetailsDownload Syllabusbeginner3 Months4.7 stars 143 reviewsIn collaboration with:ThoughtWorksProgram DetailsDownload SyllabusIn collaboration with:ThoughtWorks","https://www.udacity.com/course/agile-software-development-nanodegree--nd144","4.7","143"
"1668875191-46623","https://www.udacity.com/courses/all?field=school-of-product-management","Digital Freelancer","The goal of the Digital Freelancer Nanodegree program is to prepare students to enter the digital marketplace by teaching key skills to create a successful digital business. Students will learn freelancing basics and essential skills as well as how to build their personal brand to start a successful online business in the global freelancing marketplace.","https://www.udacity.com/www-proxy/contentful/assets/2y9b3o528xhq/3U3CiG1FnKGer0emHpwh1N/00ce8f98e0c65bc0f12f304a07373fb5/catalog-card-13.jpg","nanodegreeDigital FreelancerThe goal of the Digital Freelancer Nanodegree program is to prepare students to enter the digital marketplace by teaching key skills to create a successful digital business. Students will learn freelancing basics and essential skills as well as how to build their personal brand to start a successful online business in the global freelancing marketplace.Skills CoveredPortfolio Websites,  Professional Networking,  Resumes,  Social Media Presence,  Non-Disclosure Agreements,  Service Agreements,  Freelance Pricing Frameworks,  Invoicing,  Brand Design,  Elevator pitches,  Formal Written Communication,  Project management tools,  Project scopingPrerequisitesBasic computer skillsView more +Program DetailsDownload Syllabusbeginner1 MonthProgram DetailsDownload Syllabus","https://www.udacity.com/course/digital-freelancer-nanodegree--nd083","null","null"
"1668875191-46624","https://www.udacity.com/courses/all?field=school-of-product-management","Rapid Prototyping","Learning to prototype will save you time and money in the development process. You’ll create quality apps faster and have confidence in the viability of your products.","https://d20vrrgs8k4bvw.cloudfront.net/images/courses/thumbnails/ud723_thumbnail.jpg","freeRapid PrototypingLearning to prototype will save you time and money in the development process. You’ll create quality apps faster and have confidence in the viability of your products.Skills CoveredPrototyping, User Research, inVisionView more +Program Detailsintermediate3 WeeksIn collaboration with:GoogleProgram DetailsIn collaboration with:Google","https://www.udacity.com/course/rapid-prototyping--ud723","null","null"
"1668875191-46625","https://www.udacity.com/courses/all?field=school-of-product-management","Product Design","Learn product validation, UI/UX practices, Google’s Design Sprint and the process for setting and tracking actionable metrics.","https://d20vrrgs8k4bvw.cloudfront.net/images/courses/thumbnails/ud509_thumbnail.jpg","freeProduct DesignLearn product validation, UI/UX practices, Google’s Design Sprint and the process for setting and tracking actionable metrics.Skills CoveredProduct Design, Design Sprints, Ideation and Validation, UI/UXView more +Program Detailsintermediate2 MonthsIn collaboration with:GoogleProgram DetailsIn collaboration with:Google","https://www.udacity.com/course/product-design--ud509","null","null"
"1668875191-46626","https://www.udacity.com/courses/all?field=school-of-product-management","App Monetization","Learn how to effectively develop, implement, and measure your monetization strategy, iterating on the model as appropriate.","https://d20vrrgs8k4bvw.cloudfront.net/images/courses/thumbnails/ud518_thumbnail.jpg","freeApp MonetizationLearn how to effectively develop, implement, and measure your monetization strategy, iterating on the model as appropriate.Skills CoveredProduct Design, Google AnalyticsView more +Program Detailsintermediate1 MonthIn collaboration with:GoogleProgram DetailsIn collaboration with:Google","https://www.udacity.com/course/app-monetization--ud518","null","null"
"1668875191-46627","https://www.udacity.com/courses/all?field=school-of-product-management","A/B Testing for Business Analysts","The A/B Testing course provides students with the foundational knowledge to design and analyze A/B tests to create business insights and support decision making.","https://d20vrrgs8k4bvw.cloudfront.net/images/courses/thumbnails/ud979_thumbnail.jpg","freeA/B Testing for Business AnalystsThe A/B Testing course provides students with the foundational knowledge to design and analyze A/B tests to create business insights and support decision making.Skills CoveredA/B Randomized Design Tests, A/B Matched Pair Design TestsView more +Program Detailsintermediate3 WeeksProgram Details","https://www.udacity.com/course/ab-testing--ud979","null","null"
"1668875191-46628","https://www.udacity.com/courses/all?field=school-of-product-management","Product Manager Interview Preparation","Ace your product management interview by understanding how to answer key strategic, technical, and practical product questions.","https://d20vrrgs8k4bvw.cloudfront.net/images/course-catalog/en-us/ud034-catalog-image.jpg","freeProduct Manager Interview PreparationAce your product management interview by understanding how to answer key strategic, technical, and practical product questions.Skills CoveredProduct Management, Interview Preparation, Career Advancement, Product Strategy, Technical InterviewView more +Program Detailsbeginner1 WeekProgram Details","https://www.udacity.com/course/product-manager-interview-preparation--ud034","null","null"
"1668875193-46629","https://www.udacity.com/courses/all?field=school-of-data-science","Data Engineer","Data engineering is the foundation for the new world of Big Data. Enroll now to build production-ready data infrastructure, an essential skill for advancing your data career.","https://d20vrrgs8k4bvw.cloudfront.net/images/degrees/nd027/nd-card.jpg","nanodegreeData EngineerData engineering is the foundation for the new world of Big Data. Enroll now to build production-ready data infrastructure, an essential skill for advancing your data career.Skills CoveredData Modeling, Data Pipelines, Data Lakes, Spark, AirflowPrerequisitesIntermediate Python & SQLView more +Program DetailsDownload Syllabusintermediate5 Months4.6 stars 1783 reviewsIn collaboration with:InsightProgram DetailsDownload SyllabusIn collaboration with:Insight","https://www.udacity.com/course/data-engineer-nanodegree--nd027","4.6","1783"
"1668875193-46630","https://www.udacity.com/courses/all?field=school-of-data-science","Data Scientist","Build effective machine learning models, run data pipelines, build recommendation systems, and deploy solutions to the cloud with industry-aligned projects.","https://d20vrrgs8k4bvw.cloudfront.net/images/degrees/nd025/nd-card.jpg","nanodegreeData ScientistBuild effective machine learning models, run data pipelines, build recommendation systems, and deploy solutions to the cloud with industry-aligned projects.Skills CoveredMachine Learning, Deep Learning, Software EngineeringPrerequisitesPython, SQL & StatisticsView more +Program DetailsDownload Syllabusadvanced4 Months4.7 stars 1199 reviewsIn collaboration with:Bertelsmann, Figure Eight, IBM Watson, Insight, Kaggle, StarbucksProgram DetailsDownload SyllabusIn collaboration with:Bertelsmann, Figure Eight, IBM Watson, Insight, Kaggle, Starbucks","https://www.udacity.com/course/data-scientist-nanodegree--nd025","4.7","1199"
"1668875193-46631","https://www.udacity.com/courses/all?field=school-of-data-science","Business Analytics","Gain foundational data skills like analyzing data, modeling business scenarios, and communicating findings.","https://d20vrrgs8k4bvw.cloudfront.net/images/degrees/nd100/nd-card.jpg","nanodegreeBusiness AnalyticsGain foundational data skills like analyzing data, modeling business scenarios, and communicating findings.Skills CoveredExcel & Spreadsheets, SQL, Data Visualization, Data DashboardsPrerequisitesNoneView more +Program DetailsDownload Syllabusbeginner3 Months4.8 stars 2642 reviewsIn collaboration with:ModeProgram DetailsDownload SyllabusIn collaboration with:Mode","https://www.udacity.com/course/business-analytics-nanodegree--nd098","4.8","2642"
"1668875193-46632","https://www.udacity.com/courses/all?field=school-of-data-science","Programming for Data Science with Python","Learn the fundamental programming tools for data professionals: Python, SQL, terminal, and Git.","https://d20vrrgs8k4bvw.cloudfront.net/images/degrees/nd104/nd-card.jpg","nanodegreeProgramming for Data Science with PythonLearn the fundamental programming tools for data professionals: Python, SQL, terminal, and Git.Skills CoveredPython, Numpy & Pandas, SQL, Git & GitHubPrerequisitesNoneView more +Program DetailsDownload Syllabusbeginner3 Months4.7 stars 1545 reviewsIn collaboration with:ModeProgram DetailsDownload SyllabusIn collaboration with:Mode","https://www.udacity.com/course/programming-for-data-science-nanodegree--nd104","4.7","1545"
"1668875193-46633","https://www.udacity.com/courses/all?field=school-of-data-science","Data Analyst","Use Python, SQL, and statistics to uncover insights, communicate critical findings, and create data-driven solutions.","https://d20vrrgs8k4bvw.cloudfront.net/images/degrees/nd002/nd-card.jpg","nanodegreeData AnalystUse Python, SQL, and statistics to uncover insights, communicate critical findings, and create data-driven solutions.Skills CoveredData Wrangling, Matplotlib, Bootstrapping, Pandas & NumPy, StatisticsPrerequisitesPython & SQLView more +Program DetailsDownload Syllabusintermediate4 Months4.6 stars 3485 reviewsIn collaboration with:KaggleProgram DetailsDownload SyllabusIn collaboration with:Kaggle","https://www.udacity.com/course/data-analyst-nanodegree--nd002","4.6","3485"
"1668875193-46634","https://www.udacity.com/courses/all?field=school-of-data-science","SQL","Master SQL, the core language for big data analysis, to enable insight-driven decision-making and strategy.","https://d20vrrgs8k4bvw.cloudfront.net/images/degrees/nd072/catalog+image+nd072.jpg","nanodegreeSQLMaster SQL, the core language for big data analysis, to enable insight-driven decision-making and strategy.Skills CoveredSQL, PostgreSQL, JOINs, Subqueries, Window Functions, Partitions, Data Cleaning, DDL, DML, Relational and Non-Relational DatabasesPrerequisitesBasic understanding of data typesView more +Program DetailsDownload Syllabusbeginner2 Months4.6 stars 330 reviewsProgram DetailsDownload Syllabus","https://www.udacity.com/course/learn-sql--nd072","4.6","330"
"1668875193-46635","https://www.udacity.com/courses/all?field=school-of-data-science","Data Product Manager","Apply data science best practices to build products that deliver the right experience to the right users—at the right time.","https://d20vrrgs8k4bvw.cloudfront.net/images/degrees/nd030/catalog+image+nd030.jpg","nanodegreeData Product ManagerApply data science best practices to build products that deliver the right experience to the right users—at the right time.Skills CoveredData Science, Product Management, Product Design, Data Visualization, User Journey MapsPrerequisitesPrior Data Analysis & Product Management Experience RecommendedView more +Program DetailsDownload Syllabusintermediate3 Months4.3 stars 218 reviewsProgram DetailsDownload Syllabus","https://www.udacity.com/course/data-product-manager-nanodegree--nd030","4.3","218"
"1668875193-46636","https://www.udacity.com/courses/all?field=school-of-data-science","Data Analysis and Visualization with Microsoft Power BI","Utilize Microsoft Power BI as a primary tool for data pre-processing, visualization, and analysis.","https://www.udacity.com/www-proxy/contentful/assets/2y9b3o528xhq/6zlIQnEmoOGUINUlGdqxog/66e27c4847426acca10fb1a04abb66da/catalog-card-6.jpg","nanodegreeData Analysis and Visualization with Microsoft Power BIUtilize Microsoft Power BI as a primary tool for data pre-processing, visualization, and analysis.Skills CoveredPower BI,  data visulations,  data modeling,  Extract-Transform-Load,  Data Analytics ExpressionsPrerequisitesMicrosoft ExcelView more +Program DetailsDownload Syllabusbeginner3 Months4.7 stars 252 reviewsProgram DetailsDownload Syllabus","https://www.udacity.com/course/data-analysis-and-visualization-with-power-BI-nanodegree--nd331","4.7","252"
"1668875193-46637","https://www.udacity.com/courses/all?field=school-of-data-science","Data Engineering with Microsoft Azure","Master job-ready Azure skills like designing data models and utilizing other in-demand components of the cloud computing service.","https://www.udacity.com/www-proxy/contentful/assets/2y9b3o528xhq/1fjwcY3a2Ywmqdyg4Tchg2/c2a4bc64da3c1f946dd98da8df936fbe/catalog-card-25.jpg","nanodegreeData Engineering with Microsoft Azure Master job-ready Azure skills like designing data models and utilizing other in-demand components of the cloud computing service.Skills CoveredDatabase Normalization,  Data Modeling Basics,  PostgreSQL,  SQL and SQL scripting, Denormalized Data Schemas,  Relational data modeling,  OLAP Cubes,  Data Warehouse Architecture,  Data Extraction,  Big Data Fluency,  Apache Spark,  Data Lakes,  Apache Airflow,  Azure Pipelines
PrerequisitesExperience with SQL, Python, Azure, and GithubView more +Program DetailsDownload Syllabusintermediate4 MonthsProgram DetailsDownload Syllabus","https://www.udacity.com/course/data-engineering-with-microsoft-azure-nanodegree--nd0277","null","null"
"1668875193-46638","https://www.udacity.com/courses/all?field=school-of-data-science","Data Architect","Learn how to plan, design and implement enterprise data infrastructure solutions and create the blueprints for your organization’s data success.","https://www.udacity.com/www-proxy/contentful/assets/2y9b3o528xhq/57CBhUHtTbT21Fz6kBUCJ9/d98ee0a1bb9fadf93078d07543a1300a/man-with-tablet-catalog-card.jpg","nanodegreeData ArchitectLearn how to plan, design and implement enterprise data infrastructure solutions and create the blueprints for your organization’s data success.Skills CoveredEntity relationship diagrams,  Relational Data Design,  Online Analytical Processing,  Operational Data Stores,  Data Lake Architecture,  Data Governance
PrerequisitesIntermediate Python, SQL, and Basics of ETL/Data PipelinesView more +Program DetailsDownload Syllabusadvanced4 Months4.5 stars 115 reviewsProgram DetailsDownload Syllabus","https://www.udacity.com/course/data-architect-nanodegree--nd038","4.5","115"
"1668875193-46639","https://www.udacity.com/courses/all?field=school-of-data-science","Data Streaming","Learn how to stream data to unlock key insights in real-time.","https://d20vrrgs8k4bvw.cloudfront.net/images/degrees/nd029/nd-card.jpg","nanodegreeData StreamingLearn how to stream data to unlock key insights in real-time.Skills CoveredData Streaming, Spark, Kafka, Kafka Streaming, Spark StreamingPrerequisitesIntermediate Python, SQL, and experience with ETLView more +Program DetailsDownload Syllabusadvanced2 Months4.3 stars 241 reviewsProgram DetailsDownload Syllabus","https://www.udacity.com/course/data-streaming-nanodegree--nd029","4.3","241"
"1668875193-46640","https://www.udacity.com/courses/all?field=school-of-data-science","Predictive Analytics For Business","Learn essential AI concepts including search, optimization, planning, pattern recognition, and more from experts like Peter Norvig and Sebastian Thrun.","https://d20vrrgs8k4bvw.cloudfront.net/images/degrees/nd008/nd-card.jpg","nanodegreePredictive Analytics For BusinessLearn essential AI concepts including search, optimization, planning, pattern recognition, and more from experts like Peter Norvig and Sebastian Thrun.Skills CoveredData Wrangling, Classification, A/B Testing, Forecasting, SegmentationPrerequisitesAlgebra, Descriptive Statistics, and ExcelView more +Program DetailsDownload Syllabusbeginner3 Months4.7 stars 551 reviewsIn collaboration with:AlteryxProgram DetailsDownload SyllabusIn collaboration with:Alteryx","https://www.udacity.com/course/predictive-analytics-for-business-nanodegree--nd008t","4.7","551"
"1668875193-46641","https://www.udacity.com/courses/all?field=school-of-data-science","Data Visualization","Combine data, visuals, and narrative to tell impactful stories and make data-driven decisions.","https://d20vrrgs8k4bvw.cloudfront.net/images/degrees/nd197/nd-card.png","nanodegreeData VisualizationCombine data, visuals, and narrative to tell impactful stories and make data-driven decisions.Skills CoveredData Visualization, Tableau, Dashboards, Data StorytellingPrerequisitesBasic Data AnalysisView more +Program DetailsDownload Syllabusbeginner4 Months4.6 stars 206 reviewsProgram DetailsDownload Syllabus","https://www.udacity.com/course/data-visualization-nanodegree--nd197","4.6","206"
"1668875193-46642","https://www.udacity.com/courses/all?field=school-of-data-science","Digital Freelancer","The goal of the Digital Freelancer Nanodegree program is to prepare students to enter the digital marketplace by teaching key skills to create a successful digital business. Students will learn freelancing basics and essential skills as well as how to build their personal brand to start a successful online business in the global freelancing marketplace.","https://www.udacity.com/www-proxy/contentful/assets/2y9b3o528xhq/3U3CiG1FnKGer0emHpwh1N/00ce8f98e0c65bc0f12f304a07373fb5/catalog-card-13.jpg","nanodegreeDigital FreelancerThe goal of the Digital Freelancer Nanodegree program is to prepare students to enter the digital marketplace by teaching key skills to create a successful digital business. Students will learn freelancing basics and essential skills as well as how to build their personal brand to start a successful online business in the global freelancing marketplace.Skills CoveredPortfolio Websites,  Professional Networking,  Resumes,  Social Media Presence,  Non-Disclosure Agreements,  Service Agreements,  Freelance Pricing Frameworks,  Invoicing,  Brand Design,  Elevator pitches,  Formal Written Communication,  Project management tools,  Project scopingPrerequisitesBasic computer skillsView more +Program DetailsDownload Syllabusbeginner1 MonthProgram DetailsDownload Syllabus","https://www.udacity.com/course/digital-freelancer-nanodegree--nd083","null","null"
"1668875193-46643","https://www.udacity.com/courses/all?field=school-of-data-science","Data Science for Business Leaders","Master the people, platforms, and processes required to leverage the power of Data Science in your business.","https://d20vrrgs8k4bvw.cloudfront.net/images/course-catalog/en-us/nd045-catalog-card.jpg","nanodegreeData Science for Business LeadersMaster the people, platforms, and processes required to leverage the power of Data Science in your business.Skills CoveredBusiness Strategy, Data Science, Data Architecture, Machine Learning, Human CapitalPrerequisitesStatistics, Probability, and Business ExperienceView more +Program DetailsDownload Syllabusintermediate2 Months4.4 stars 81 reviewsIn collaboration with:AlteryxProgram DetailsDownload SyllabusIn collaboration with:Alteryx","https://www.udacity.com/course/data-science-for-business-leaders--nd045","4.4","81"
"1668875193-46644","https://www.udacity.com/courses/all?field=school-of-data-science","Programming for Data Science with R","Prepare for a data science career by learning the fundamental data programming tools: R, SQL, command line, and git.","https://d20vrrgs8k4bvw.cloudfront.net/images/degrees/nd118/nd-card.jpg","nanodegreeProgramming for Data Science with RPrepare for a data science career by learning the fundamental data programming tools: R, SQL, command line, and git.Skills CoveredR, SQL, GitPrerequisitesNoneView more +Program DetailsDownload Syllabusbeginner3 Months4.8 stars 95 reviewsIn collaboration with:ModeProgram DetailsDownload SyllabusIn collaboration with:Mode","https://www.udacity.com/course/programming-for-data-science-nanodegree-with-R--nd118","4.8","95"
"1668875193-46645","https://www.udacity.com/courses/all?field=school-of-data-science","Privacy Engineer","Master the skills necessary to become a successful privacy engineer. Learn to create technical solutions and implement privacy principles by integrating Privacy-by-Design into product development, data infrastructure, and software release lifecycles.","https://www.udacity.com/www-proxy/contentful/assets/2y9b3o528xhq/5gPIXxuzpCo816ggPRxvd2/6168722ef2139b7f1c7c016d08165d0d/catalog-card-18.jpg","nanodegreePrivacy EngineerMaster the skills necessary to become a successful privacy engineer. Learn to create technical solutions and implement privacy principles by integrating Privacy-by-Design into product development, data infrastructure, and software release lifecycles.Skills CoveredPrivacy by Design Framework,  Data Minimization,  Data Encryption,  Sensitive Data Tracking,  Hashing,  Privacy Risk Assessment,  Data Privacy Fundamentals,  Data Anonymization,  k-anonymization,  Data Privacy Regulations,  Tiers of Deletion,  Redaction for Data Minimization,  Regional Privacy Regulations,  Data Lifecycle ManagementPrerequisitesPython and SQLView more +Program DetailsDownload Syllabusintermediate2 MonthsProgram DetailsDownload Syllabus","https://www.udacity.com/course/privacy-engineer-nanodegree--nd325","null","null"
"1668875193-46646","https://www.udacity.com/courses/all?field=school-of-data-science","Intro to Data Analysis","Explore a variety of datasets, posing and answering your own questions about each. You'll be using the Python libraries NumPy, Pandas, and Matplotlib.","https://d20vrrgs8k4bvw.cloudfront.net/images/courses/thumbnails/ud170_thumbnail.jpg","freeIntro to Data AnalysisExplore a variety of datasets, posing and answering your own questions about each. You'll be using the Python libraries NumPy, Pandas, and Matplotlib.Skills CoveredData Analysis, Python, numpy, pandasView more +Program Detailsbeginner6 WeeksProgram Details","https://www.udacity.com/course/intro-to-data-analysis--ud170","null","null"
